{
  "schemaVersion": 1,
  "kind": "plugin",
  "id": "dsh-composer-picker",
  "packageName": "dsh-composer-picker",
  "repository": "NOirBRight/dsh-composer-picker",
  "category": "interface",
  "version": "0.1.3",
  "tag": "v0.1.3",
  "commit": "2ecd2c91322f89abdc6b5de912216a6c28b13c9e",
  "license": "MIT",
  "profiles": [
    "web"
  ],
  "dshCompatibility": ">=0.1.0-rc.6 <0.1.1 || >=0.1.1-rc.1 <1.0.0 || >=0.1.2-alpha.1 <1.0.0",
  "status": "deprecated",
  "descriptions": {
    "en": "Client-only suffix-grouped composer model picker with standalone Plan Review and no provider runtime dependency.",
    "zh": "纯客户端后缀分组 Composer 模型选择器，带独立 Plan Review，不依赖具体 Provider 运行时。"
  },
  "policyFlags": [
    "ui-extension"
  ],
  "notice": {
    "en": "This plugin has been absorbed by dsh-model-switch. Do not install both because they compete for the same picker seat.",
    "zh": "该插件已并入 dsh-model-switch。请勿同时安装，两者会竞争同一个选择器位置。"
  }
}
