{
  "schemaVersion": 1,
  "kind": "companion-app",
  "id": "dsh-mobile",
  "packageName": "dsh-mobile",
  "repository": "NOirBRight/dsh-mobile",
  "category": "remote",
  "version": "1.1.1-test.20260824.9",
  "tag": "mobile-picker-fix-0.1.14",
  "commit": "3d65ddb28d57d3c3eb5f68c1f5ba532405961d1b",
  "license": "NOASSERTION",
  "profiles": [],
  "dshCompatibility": ">=0.1.0-rc.6",
  "status": "active",
  "descriptions": {
    "en": "Android companion for your own DSH Host with QR pairing, end-to-end encrypted tunnel transport, official features, and a mobile layout.",
    "zh": "连接自有 DSH Host 的 Android 配套应用，提供扫码配对、端到端加密隧道、官方功能和手机布局。"
  },
  "policyFlags": [
    "credentials",
    "network",
    "remote-access"
  ],
  "artifact": {
    "name": "app-release.apk",
    "downloadUrl": "https://github.com/NOirBRight/dsh-mobile/releases/download/mobile-picker-fix-0.1.14/app-release.apk",
    "sha256": "e06f26e03bda6a6c3a2c3b15d437e8169b177e78a1119a1ee607e0c239fed4b7"
  },
  "notice": {
    "en": "Requires dsh-mobile-pairing on the Host. This latest stable patch release reports Android versionName 1.1.1-test.20260824.9. The source repository currently has no root license declaration.",
    "zh": "需要在 Host 安装 dsh-mobile-pairing。该最新稳定补丁版的 Android versionName 为 1.1.1-test.20260824.9；源码仓库目前没有根许可证声明。"
  }
}
