{
  "schemaVersion": 1,
  "kind": "plugin",
  "id": "dsh-llm-opencode-go",
  "packageName": "dsh-llm-opencode-go",
  "repository": "NOirBRight/dsh-llm-opencode-go",
  "category": "models",
  "version": "0.1.13",
  "tag": "v0.1.13",
  "commit": "6c9ea8ea106912c27792c6722433787c57335ed1",
  "license": "MIT",
  "profiles": [
    "web"
  ],
  "dshCompatibility": ">=0.1.0-rc.6 <0.1.1 || >=0.1.1-rc.1 <1.0.0 || >=0.1.2-alpha.1 <1.0.0",
  "status": "active",
  "descriptions": {
    "en": "OpenCode Go models with per-model Completions, Responses, or Anthropic Messages routing, discovery, and subscription usage.",
    "zh": "OpenCode Go 模型集成，按模型路由 Completions、Responses 或 Anthropic Messages，并提供发现和订阅用量。"
  },
  "policyFlags": [
    "credentials",
    "network",
    "third-party-service",
    "third-party-subscription"
  ]
}
